last_error_category,users_count
"Выполнение действия HtmlElement id: <id> группы действий id: <id> Не найден HTML элемент, по условиям поиска",54
Null reference,14
Выполнение действия List id: <id> группы действий id: <id> Список пуст | System.Exception: Список пуст,13
运行HTMLElement 动作id<id> 动作组id<id> 根据搜索条件未找到HTML元素,12
Running HtmlElement action id: <id> action group id: <id> An HTML element matching the search criteria hasn't been found,12
Proxy issue,10
Выполнение логического оператора If действия id: <id> группы действий id: <id> Результат: false,8
Captcha/anti-bot,7
Взятие строки из таблицы действия id: <id> группы действий id: <id> Строки с номером не существует в таблице,6
Парсинг страницы действия id: <id> группы действий id: <id> Не найдены элементы по заданным параметрам,6
Argument error,5
Taking line from the table action id: <id> action group id: <id> Line No. does not exist in the table,5
Rate limit,5
"Выполнение действия Touch HtmlElement id: <id> группы действий id: <id> Не найден HTML элемент либо вкладка, по условиям поиска",4
Run List action id: <id> action group id: <id> List is empty | System.Exception: List is empty,4
Выполнение действия ProjectInProject id: <id> группы действий id: <id> Ошибка при обработке,4
运行WebBrowserSettings 动作id<id> 动作组id<id> 访问实例错误.ClearCookie | System.Exception: 访问实例错误.ClearCookie,3
"Выполнение действия Получить список профилей ZennoBrowser id: <id> группы действий id: <id> Status(StatusCode=""Unauthenticated"", Detail=""Bad",3
Выполнение действия Запустить инстанс ZennoBrowser id: <id> группы действий id: <id> Ошибка запуска профиля ZennoBrowser (<id>): Status(Stat,3
Timeout,3
Running the Profile action id: <id> action group id: <id> Could not find matching profile. | System.Data.ObjectNotFoundException: Could not ,2
File not found,2
Выполнение действия List id: <id> группы действий id: <id> Ошибка при обработке списка,2
"Выполнение действия Parse Json/Xml id: <id> группы действий id: <id> Error reading JToken from JsonReader. Path '', line 0, position 0. | Sy",2
Выполнение действия Http id: <id> группы действий id: <id> Превышен таймаут ResourceDownloader.GetResult. | System.Exception: Превышен тайма,2
Выполнение действия Emulation id: <id> группы действий id: <id> Ошибка обращения к Instance.SendText | System.Exception: Ошибка обращения к ,2
Выполнение действия CSharp OwnCode. id: <id> группы действий id: <id> Поток находился в процессе прерывания. | System.Threading.ThreadAbortE,2
Выполнение действия WebBrowserSettings id: <id> группы действий id: <id> Ошибка обращения к Instance.ClearCookie | System.Exception: Ошибка ,2
Not found,2
Выполнение действия Emulation id: <id> группы действий id: <id> Входная строка имела неверный формат. | System.FormatException: Входная стро,2
Выполнение действия List id: <id> группы действий id: <id> Искомый элемент отсутствует в списке | System.Exception: Искомый элемент отсутств,2
Выполнение действия Db id: <id> группы действий id: <id> You have an error in your SQL syntax; check the manual that corresponds to your MyS,2
Выполнение действия ImageProcessing id: <id> группы действий id: <id> Ошибка при получении изображения,2
Server unavailable,2
Выполнение действия Создать профили ZennoBrowser id: <id> группы действий id: <id> Списка с указанным именем не существует,2
Выполнение действия Создать профили ZennoBrowser id: <id> группы действий id: <id> ZennoBrowser не установлен | System.Exception: ZennoBrows,2
Unauthorized,2
Running the logical IF-statement action id: <id> action group id: <id> Result: false,2
Выполнение действия Directory id: <id> группы действий id: <id> Ошибка при работе с директорией,2
Выполнение действия Http id: <id> группы действий id: <id> Ошибка запроса,2
Executing the Get ZennoBrowser profiles action id: <id> action group id: <id> ZennoBrowser not installed | System.Exception: ZennoBrowser no,1
Running the VariableOperations action id: <id> action group id: <id> Variable is not a number | System.FormatException: Input string was not,1
Executing action WebBrowserExtensions id: <id> of action group id: <id> Error accessing Instance.InstallCrxExtension | System.Exception: Err,1
Выполнение действия CSharp OwnCode. id: <id> группы действий id: <id> [Строка: 22; Cтолбец: 0] <n>.. Нет xpath элемента: //h1[contains(@clas,1
Server 500,1
Выполнение действия WebBrowserExtensions id: <id> группы действий id: <id> Can't uninstall extension pabjfbciaedomjjfelfafejkppknjleh | Syst,1
Выполнение действия FTPDirectory id: <id> группы действий id: <id> Ошибка при работе с FTP,1
Выполнение программы C:\Zenno\OpenAi-TTS\ffmpeg.exe действия id: <id> группы действий id: <id> Результат: -<n>,1
Running the WebBrowserSettings action id: <id> action group id: <id> Object reference not set to an instance of an object,1
执行动作C#自定义代码: FilterState2.id: <id> 动作组 id: <id> [行: 6; 列: 0] invalid state | System.Exception: invalid state,1
Выполнение действия CSharp OwnCode. id: <id> группы действий id: <id> Недостаточно памяти. | System.OutOfMemoryException: Недостаточно памят,1
Subproject FreedomBlueprint. Running HtmlElement action id: <id> action group id: <id> subproject path: C:\Users\gaabs\Documents\zennoPoster,1
Выполнение программы C:\mobirise-automation\mobirise.bat действия id: <id> группы действий id: <id> Результат: <n>,1
Perform the JavaScript OwnCode action id: <id> action group id: <id> Error accessing Document.EvaluateScript | System.Exception: Error acces,1
"Выполнение действия Создать профили ZennoBrowser id: <id> группы действий id: <id> Status(StatusCode=""Unauthenticated"", Detail=""Bad gRPC res",1
Executing action ImageProcessing id: <id> Action Group id: <id> Error loading image,1
Выполнение действия CSharp OwnCode: arbbridge. id: <id> группы действий id: <id> Поток находился в процессе прерывания. | System.Threading.T,1
Выполнение действия WebBrowserSettings id: <id> группы действий id: <id> Ошибка обращения к Instance.ClearCache | System.Exception: Ошибка о,1
Выполнение действия ParsePage id: <id> группы действий id: <id> Invalid format of the collection numbers. ElementsInCollection: 16. Path: -1,1
运行IF-statmen逻辑 动作id<id> 动作组id<id> 结果：false,1
"Поиск текста на странице действия id: <id> группы действий id: <id> Не найден, Url: https://b.dom-edinstva.ru/crm/lead/details/<n>/, Regex: ",1
"Выполнение действия Profile id: <id> группы действий id: <id> Файла не существует по пути ""C:\Users\Administrator\Desktop\zenno\orders\eugen",1
Access denied,1
"Поиск текста на странице действия id: <id> группы действий id: <id> Не найден, Url: http://wlb-promo.local/5x-product-check, Regex: Все\s+то",1
Выполнение действия Emulation id: <id> группы действий id: <id> Ошибка при обработке,1
Выполнение действия Запустить инстанс ZennoBrowser id: <id> группы действий id: <id> Ошибка запуска профиля ZennoBrowser (<id>): Can't conne,1
Выполнение действия CSharp OwnCode: Parser-get. id: <id> группы действий id: <id> Поток находился в процессе прерывания. | System.Threading.,1
执行动作C#自定义代码: 检查元素.id: <id> 动作组 id: <id> Server Error (ElementIsExists): element not exists | System.Exception: Server Error (ElementIsExists,1
Выполнение действия Table id: <id> группы действий id: <id> Ошибка при обработке таблицы,1
"Выполнение действия Parse Json/Xml id: <id> группы действий id: <id> Unexpected character encountered while parsing value: <. Path '', line ",1
执行动作C#自定义代码.id: <id> 动作组 id: <id> Thread was being aborted. | System.Threading.ThreadAbortException: Thread was being aborted,1
Подпроект readability_example. Выполнение действия CSharp OwnCode: Exc. id: <id> группы действий id: <id> подпроект path: C:\Users\Администр,1
"执行解析Json/Xml动作 id: <id> 动作分组ID: <id> Unexpected character encountered while parsing value: ﻿. Path '', line 0, position 0. | System.Exceptio",1
Выполнение действия Sms Service id: <id> группы действий id: <id> Некорректное наименование сервиса | System.Exception: Некорректное наимено,1
Executing action CSharp OwnCode.id: <id> action group id: <id> Thread was being aborted. | System.Threading.ThreadAbortException: Thread was,1
Executing action CSharp OwnCode: SUGGESTED⇒TEMP（一括コピー）修正版.id: <id> action group id: <id> Thread was being aborted,1
Взятие строки из таблицы действия id: <id> группы действий id: <id> Ошибка при обработке таблицы,1
执行该动作的JavaScript OwnCode 动作id:<id> 动作组id:<id> CdpDocument.EvaluateScript failed | System.Exception: CdpDocument.EvaluateScript failed,1
Extension installer not found,1
Выполнение действия CSharp OwnCode: Генерация нового профиля. id: <id> группы действий id: <id> Поток находился в процессе прерывания. | Sys,1
Выполнение действия Table id: <id> группы действий id: <id> Индекс находился вне границ массива. | System.IndexOutOfRangeException: Индекс н,1
Выполнение действия Запустить инстанс ZennoBrowser id: <id> группы действий id: <id> Все профили указанной папки заняты | ZennoLab.ZennoPost,1
Subproject modulo_test_change_domain. Executing the Db action id: <id> of action group id: <id> subproject path: G:\My Drive\RPA-PROJECT\RPA,1
Подпроект class-email-rambler-login-with-fa. Выполнение действия ProjectInProject id: <id> группы действий id: <id> подпроект path: C:\Users,1
"Executing the Create ZennoBrowser profiles action id: <id> action group id: <id> {""ExceptionJson"":[""{\u0022$type\u0022:\u0022ZennoLab.Platfo",1
Выполнение действия Остановить инстанс id: <id> группы действий id: <id> Ошибка обращения к Instance.PrepareInstance | System.Exception: Оши,1
Running the WebBrowserSettings action id: <id> action group id: <id> Error accessing Instance.ClearCookie | System.Exception: Error accessin,1
Выполнение действия Получить список профилей ZennoBrowser id: <id> группы действий id: <id> Can't connect to ZennoBrowser | System.Exception,1
"Поиск текста на странице действия id: <id> группы действий id: <id> Не найден, Url: https://2ip.ru/, Regex: Вая\s+IP",1
"Searching text on a page action id: <id> of action group id: <id> Not found, Url: https://www.iplocation.net/, Regex: JustOctane",1
Выполнение действия TextProcessing id: <id> группы действий id: <id> Ошибка при обработке текста,1
"执行解析Json/Xml动作 id: <id> 动作分组ID: <id> Error reading JToken from JsonReader. Path '', line 0, position 0. | System.Exception: Error reading JT",1
Subproject FB_XML-dodawanie_zdjec_miast_pracy_bio_9. Executing action ImageProcessing id: <id> Action Group id: <id> subproject path: C:\Use,1
"Выполнение действия Profile id: <id> группы действий id: <id> Файла не существует по пути ""E:\#Work\Zenka\чекер кс под инфинита\.zpprofile""",1
Выполнение действия File id: <id> группы действий id: <id> Ошибка при работе с файлом,1
Выполнение действия HtmlElement id: <id> группы действий id: <id> Ошибка обращения к Instance.GetTabByAddress | System.Exception: Ошибка обр,1
Подпроект tittok_2. Выполнение действия ProjectInProject id: <id> группы действий id: <id> подпроект path: C:\unnell\zp\tittok_2.zp Ошибка п,1
Выполнение действия CSharp OwnCode: Always Use HTTPS. id: <id> группы действий id: <id> Удаленный сервер возвратил ошибку: (<n>) Не найден. ,1
Подпроект smrch-checker_wa_dot2.01-noxtools.com_include. Поиск текста на странице действия id: <id> группы действий id: <id> подпроект path:,1
Выполнение действия CSharp OwnCode: НЕ можем нажать отправить. id: <id> группы действий id: <id> [Строка: 3; Cтолбец: 0] ERROR - НЕ можем на,1
Выполнение действия WebBrowserExtensions id: <id> группы действий id: <id> Incorrect extension parsing type! | System.InvalidOperationExcept,1
Выполнение действия JavaScript OwnCode id: <id> группы действий id: <id> EvaluateScriptAsync: Uncaught SyntaxError: Invalid or unexpected to,1
Выполнение действия CSharp OwnCode: Ожидание СМС. id: <id> группы действий id: <id> Поток находился в процессе прерывания. | System.Threadin,1
Подпроект module-discord-actions. Выполнение логического оператора If действия id: <id> группы действий id: <id> подпроект path: D:\socials\,1
Подпроект Установка 2фа веб. Выполнение действия ProjectInProject id: <id> группы действий id: <id> подпроект path: D:\модули\Установка 2фа ,1
Execution of analysis of content action id: <id> action group id: <id> Input string was not in a correct format. | System.FormatException: I,1
Perform the Touch action id: <id> action group id: <id> HTML element or tab was not found using search settings,1
"Выполнение действия Profile id: <id> группы действий id: <id> Файла не существует по пути ""C:\Users\Server\Desktop\Зенопостер\Проекты\Статис",1
"Выполнение действия List id: <id> группы действий id: <id> Не удалось найти часть пути ""E:\work\zp\Please Neither"". | System.IO.DirectoryNot",1
Выполнение действия WebBrowserData id: <id> группы действий id: <id> No such list: | ZennoLab.TemplateManipulator.V4.Helpers.InvalidVariable,1
Выполнение действия CSharp OwnCode: Получить прокси. id: <id> группы действий id: <id> [Строка: 17; Cтолбец: 4] Исходный файл не найден | Sy,1
Выполнение действия Profile id: <id> группы действий id: <id> Ошибка при работе с профилем: Загружаемый профиль (Chrome) не соответствует те,1
Выполнение действия Emulation id: <id> группы действий id: <id> Выполнение прервано | System.Exception: Выполнение прервано,1
Выполнение действия CSharp OwnCode. id: <id> группы действий id: <id> [Строка: <n>; Cтолбец: 8] ❌ Нет доступных аккаунтов в файле accounts.t,1
Executing action CSharp OwnCode.id: <id> action group id: <id> The device is not ready. | System.IO.IOException: The device is not ready,1
Выполнение действия Plugin id: <id> группы действий id: <id> Ошибка при обработке плагина Cap.Guru.27.6_all Ошибка в действии: <id>,1
Выполнение действия CSharp OwnCode: Модуль 1: парсим JSON - vulnsString. id: <id> группы действий id: <id> Unexpected character encountered ,1
Выполнение действия WebBrowserTab id: <id> группы действий id: <id> Не нашли вкладку в инстансе. Инстанс <n>:<n>.0.0.1 | System.Exception: Н,1
Выполнение действия ProjectInProject id: <id> группы действий id: <id> Плагин по пути C:\Users\Admin\Documents\ZennoLab\Plugins\Local\result,1
Выполнение действия CSharp OwnCode: выбор random видео. id: <id> группы действий id: <id> [Строка: 12; Cтолбец: 0] Индекс находился вне гран,1
Running the WebBrowserTabManagment action id: <id> action group id: <id> Tab popup is not found in instance. Instance <n>:<n>.0.0.1 | System,1
Подпроект 100к. Выполнение действия ProjectInProject id: <id> группы действий id: <id> подпроект path: C:\Users\Admin\Desktop\dist\Автоперек,1
"Searching text on a page action id: <id> of action group id: <id> Not found, Url: https://www.sejda.com/pdf-editor, Regex: Reached end of th",1
